,text,title
20,"Growing a physique that's not just eye-catching, but downright freakily amazing, doesn't happen by accident. It takes hard work, but also a smart approach to splitting up your training. The Bodybuilding.com All Access program <a href=""https://www.bodybuilding.com/workout-plans/about/freakmode-alex-savva-12-week-fitness-plan"">FreakMode: Alex Savva's 12-Week Fitness Plan</a> will give you both. For the first four weeks, the program is designed to help stimulate growth by attacking body parts as a group based on prime movers and their synergists. For example, the chest is a prime mover (main muscle) on a bench press, while the shoulders and triceps are synergists (assisting muscles). Because the synergist muscles are targeted during every exercise prescribed in each workout, they'll be close to exhaustion by the time you work them individually. That means you'll only need to do a few sets to finish them off. This workout, from Day 1 of FreakMode, shouldn't take you more than 30-45 minutes. Keep the rest periods short so the sets are intense and effective. By increasing the demand of the work, you effectively increase the stress to your body, which is exactly what will cause your muscles to grow and your fat to evaporate. <strong>Exercise Alternatives</strong>",Build That Freaky Upper Body With This Workout!
21,"Learning basic moves for biceps is essential when you're just starting out, but the basics alone won't work forever. Advancing your exercise knowledge can help you with everything from warming up to smashing PRs. If bigger biceps are your goal, use these advanced exercises to accelerate your upper-arm growth. The <a href=""https://www.bodybuilding.com/content/lawrence-ballengers-big-fun-arm-blast.html"">Zottman</a> curl is a great warm-up exercise to pre-exhaust the biceps. This exercise helps you warm up all parts of the biceps, as well as the brachialis, forearms, and elbows. There's no need to go excessively heavy here. Take your time with each rep and use lighter weight. Use this exercise to help you feel the biceps working, pump more blood into the target muscles, and prepare your elbows for the harder work to come. Begin curling the dumbbells as if you're doing a traditional curl. However, at the top, twist your wrists so your palms face forward, as they would at the top of a reverse curl. Lower the weights, resetting to the palms-forward starting position at the bottom. Rest 60 seconds between each set. Thick grips work your forearms and challenge your biceps in a way that a regular bar won't. It forces the biceps to work harder. You also won't be able to <a href=""https://www.bodybuilding.com/content/unlock-triceps-growth-with-this-one-move.html"">lift super heavy</a> since your hands will be holding a thicker handle. Thick grip curls allow you to do a unique kind of dropset. Perform your curls to failure with the grips. Once you reach failure, take off your grips, grab the bar as you normally would, and perform at least a couple more reps before your arms fail again. The weight you select should lead to failure within the prescribed rep range. <a href=""https://www.bodybuilding.com/content/3-supersets-guaranteed-to-crank-up-your-arm-workouts.html"">Supersets</a> work best if you spend less time transitioning from one exercise to the next. With this exercise pairing, there's no need to move at all or even change weights. Start by performing the incline curls with your back resting against an incline bench. Upon reaching failure, sit up, change your hand positioning, and immediately go into the hammer curl. This exercise is easier to perform than incline curls, which is why you don't have to switch the weight even after reaching failure. One more advanced biceps tip: When you go into the hammer curl, position your hands right up against the insides of the dumbbell. This will <a href=""https://www.bodybuilding.com/fun/build-a-chest-that-stands-out-from-every-angle.html"">recruit more muscle fibers</a>, leading to better biceps growth. Cables are a great biceps finisher because <a href=""https://www.bodybuilding.com/content/the-arm-workout-youll-feel-till-next-week.html"">tension</a> will stay on the muscles throughout the entire rep. This is an isolation move so you don't have to use as much weight to make the biceps work. For those of you unfamiliar with this classic rep scheme, 21s are 7 half reps in the bottom range of motion, 7 half reps in the top range of motion, and 7 full reps. If your form is solid (meaning, no swinging or cheating), your biceps will burn. For another advanced twist, do these cable curls lying on the floor. Since your back is against the ground, you won't be able to generate momentum and your biceps must work extra hard to finish strong.",Advanced Exercises to Pump Up Your Biceps
22,"As MusclePharm-sponsored athlete and 2018 Bodybuilding.com Spokesmodel Search finalist Tyler Holt will tell you, little tweaks can make a big difference. In this quartet of chest exercises, Holt uses cables, dumbbells, and his own body weight to create a deceptively simple chest workout that has everything you need to make your chest grow. Holt has employed dropsets and unique combinations for years. Many of his part workouts were borne of the need to work past injuries while still maintaining his hard-earned size and strength. He knows exactly how to use tempo and time under tension to make your muscles work even when lifting lighter weight. ""We're going to tax your chest from every angle,"" explains Holt. ""I'm going to take you through pause reps and use some different angles with the cables. It's a quick workoutâonly four exercisesâthat should only take you about 40 minutes."" While a cross-over might sound easy enough, the progressive weight increase on every set is not. The first set of 20 reps is all about priming your muscles for what's to come. ""Get your muscles, tendons, ligaments warmed up with that first set,"" says Holt. Pause and squeeze at the top of every contraction. This will make sure your chest is working as hard as it can. Holt says to keep a slight bend in your elbow, and make sure to stretch all the way back. Your chest should have a good pump already as you hit the incline dumbbell press. ""The reason I follow the cable fly with the incline press is to focus on upper chest,"" explains Holt. ""In my opinion, that's what builds a nice, full chest, and it's very underworked for a lot of people."" As with the cable cross-over, increase the weight on every set as the reps drop. On every rep, pause at the bottom for 1-2 seconds, getting a good stretch in the chest. This pause increases the time under tension for your muscles, helping <a href=""https://www.bodybuilding.com/fun/the-full-body-workout-to-boost-the-big-three-lifts.html"">increase strength</a> gains and growth. Keep your shoulders down and back throughout, and don't lock your elbows at full extension. Many top athletes create their own workout <a href=""https://www.bodybuilding.com/content/9-muscle-building-exercises-youve-never-tried-before.html"">variations</a>, and Holt is no exception. ""This is a totally different exercise,"" he explains as he sets up for the cable press with push-up.""Instead of just doing a cable press, or just doing push-ups, you create a more dynamic exercise for the muscle. It is just going to destroy your chest."" While it may sound complicated, the cable press with push-up is straightforward. Bring the cables with you as you drop down into a push-up position, laying your palms on top of the strap portion of the handle to hold them down. Perform one push-up, then hold your body in a straight-arm plank as you bend your right elbow and lift your hand up with the cable, then press back down in a single-arm press. Place your right hand back on the ground, still holding the cable, and repeat the same motion on your left side. That's one rep. Complete 3 sets of 8-10 reps, trying to <a href=""https://www.bodybuilding.com/content/4-advanced-moves-for-extreme-arm-growth.html"">increase the weight</a> on each set. Keep your feet wide for a better base and more stability during the cable press. Start with a light weight. Once you grow comfortable with the exercise, increase the load accordingly. Make sure you maintain a strict plankâavoid twisting or swaying as you press. If the weight wants to pull your body out of alignment, you're going too heavy. This is a twist on the standard cable cross-over, this time hitting the chest at three different angles instead of one. Holt revisits this variation of his first exercise to make sure he hits every muscle fiber in the chest before the end of the workout. He recommends working to failure on all 3 sets. Effort-wise, go for it here. Don't leave anything in the tank. Set the pulleys at shoulder height to start, then pull the cables low for the first angle. Stretch back and pull the cables to mid-chest height for the second angle. Stretch back one more time and pull the cables in one more time just above your chest at about eye level. That's one rep. Repeat this sequence until you can no longer bring your hands together with good form. Rest 1-2 minutes between sets. If you like this workout, check out Holt's <a href=""https://www.bodybuilding.com/content/minimalist-muscle-building-leg-workout.html"">Minimalist Muscle-Building Leg Workout.</a>",4 Moves To A Bigger Chest With Tyler Holt
23,"IFBB Bikini pro Caryn Nicole Paolini shares her brutal summer booty workout with her best friend, Canadian Bikini pro and certified personal trainer Randi Kennedyâbecause, what else do best friends do? Co-creators of Her Fit Camp, whose mission is to provide an uplifting, positive, and empowering environment for women, these ladies know exactly how to help you target your glutes so they can look great onstageâor just chilling by the pool. Aka the scissor jump, this exercise targets every muscle in your legs. To achieve more glute activation, drop into a low lunge on each jump, and explode up from your heel, extending through the hip as you switch legs before landing on the opposite side. Land softly on each rep to protect your joints, and make sure your front knee stays over your ankleâdon't let it go past your toes. Use your arms to help or, for an extra challenge, try holding a light <a href=""https://www.bodybuilding.com/fun/the-ultimate-medicine-ball-workout.html"">medicine ball</a> on your chest and using only your legs. To target the side of your <a href=""https://www.bodybuilding.com/content/glute-workout-6-ways-to-build-your-perfect-booty.html"">booty</a>âaka the gluteus mediusâturn to the side for this move. From this position, put your top foot on the platform, toes turned slightly up. Press through your heel and extend all the way through the hip to target your glutes. Another way to think of this exercise is like you're doing a single-leg sumo squat. If your leg press won't allow you to comfortably turn to the side, sit in the seat and put one leg up, turn your toes out, and press the weight up like you normally would with both legs. This is basically a wide-stance jump squat, but using the leg press machine allows you to control the movement and better target your glutes. Place your feet slightly wider than shoulder width, and lower yourself down until you feel a stretch in the glutes. Press through your heels as you come up and ""pop"" off the platform by extending through your hips and squeezing your glutes. Land softly to <a href=""https://www.bodybuilding.com/content/strong-foundations-why-you-should-strengthen-your-core-muscles.html"">protect your knees</a>, and return to the starting position. This is a great exercise to do with a partner who can help you get into position. Lie face-down on a bench with your knees hanging off the end. Have your <a href=""https://www.bodybuilding.com/content/4-reasons-to-exercise-with-your-partner.html"">partner</a> place a dumbbell between your feet. Extend through your hips and squeeze your glutes as you curl the dumbbell toward your body using your hamstrings. For an extra booty burn, try to lift the weight straight up toward the ceiling as you curl the weight, squeezing your glutes and pressing your hips into the bench as you do so. Hip hinges <a href=""https://www.bodybuilding.com/content/taylor-chamberlains-signature-moves-for-glutes.html"">target the glutes</a>, and hyperextensions are an easy way to hinge effectively without needing to lift a lot of weight. If your gym does not have a glute-ham raise machine or Roman chair, use a stability ball and wedge your feet against a wall or under a machine. Keep your back straight as you hinge from your hips, not your lower back. You'll know you're performing this movement correctly if you feel the stretch in your hamstrings. Press through your heels and squeeze your glutes to come back up.",The Ultimate Summer Booty Workout
24,"Today is the first day of your new, stronger life. So, there's no better way to spend it than doing exactly what you'd expect in a program created by someone nicknamed ""Meg Squats""âsquatting! Meg has partnered with Bodybuilding.com to create <a href=""https://www.bodybuilding.com/workout-plans/about/uplifted-build-muscle-and-strength-with-meg-squats"">Uplifted: Build Muscle and Strength with Meg Squats</a>, a new eight-week program unlike anything Bodybuilding.com has ever offered. It's a celebration of strength and its liberating potential, but it's also your opportunity to learn what Meg has learned from some of the strongest people in the world, and put into action in her own training. When she was named the 2018 Bodybuilding.com Women's Spokesmodel Search winner, this was just what we hoped would result. Who is Uplifted for? It's perfect for any womanâor any man, but let's focus on womenâwho wants to go far down the strength rabbit hole and see what it feels like to watch the numbers go up. Yes, that means the numbers on the bar, but the numbers on the measuring tape might budge a little, too. There's no shame in getting a little bigger on this plan, and there's definitely nothing wrong with getting strong! If lifting this heavy is a brand-new world for you, great! You're welcome here, and Meg will show you everything you need to know to absolutely own this program, and to take your strength and your body where it's never been before. What's the best way to learn? By doing, of course. So before you get under the bar, watch this complete walk-through of the workout, with each set and rep guided by Meg herself. All of your questions about exercise technique, weight selection, and how close to failure is close enough are answered here! Also listen to Meg's appearance on the <a href=""https://www.bodybuilding.com/fun/podcast-episode-45-getting-uplifted-through-lifting-with-meg-squats.html"">Bodybuilding.com Podcast</a>, where she discusses her lifting history, her love of squats, and how to get the most out of the crucial first few weeks of Uplifted. We want every lifter, everywhere to be able to benefit from <a href=""https://www.bodybuilding.com/workout-plans/about/uplifted-build-muscle-and-strength-with-meg-squats"">Uplifted</a>, so feel free to use this list of acceptable exercise substitutions as needed. In the case of the primary lift, we recommend staying with the same variation throughout the program. For other lifts, it's fine if you swap them out as needed depending on what's available on any particular day.",Get Uplifted With This Squat Workout From Meg Squats!
25,"When you first start training, your upper arms grow almost without trying, regardless of your approach and technique. Inevitably, though, you hit that dreaded growth plateau and realize you need to master the basics of building muscle if you still want to put on size like you used to. Building muscle isn't just about what you do. It's about how you do it. While there are many exercises to help you work your biceps, you need these four essentials to help you build them. True muscle failure happens when you can no longer lift the weight with good form. A lot of us work around this, though, by using momentum or recruiting other muscles to lift the weight. The biceps must work in order to grow, and if other muscle groups are joining the set then you simply won't maximize your potential. Let's use barbell curls as an example. As your set progresses and your biceps fatigue, you arch your back and swing the weight up, or you recruit your shoulders by moving your elbows forward. Either way, less work is done by the biceps, and your <a href=""https://www.bodybuilding.com/content/4-arm-strategies-doomed-to-fail.html"">growth potential suffers</a>. The best way to isolate the biceps is to start light and focus on proper form. If you're still having trouble isolating your biceps, lean against a wall or use an arm blaster to keep your elbows in place. A preacher bench can also help you isolate your biceps, or you can do single-arm exercises to work each arm individually. Isolating each arm makes them do more work so you reap more benefits. It's a well-known fact that if you do the same amount of work week after week, your biceps will have no reason to adaptâand no reason to get bigger or stronger. To grow, you have to overload the muscles with more volume than they're used to handling. There are a few different ways to overload the biceps, such as increasing the weight, adding sets and reps, or upping your training frequency. The problem is you can't always keep adding more of everything, so one of the best ways to overload your biceps during your workout is by performing <a href=""https://www.bodybuilding.com/content/when-to-use-intensity-boosters-in-your-workouts.html"">forced reps</a>. Forced reps are exactly what they sound like: You force your muscles to do a few more reps once they've reached failure. To do this, have a partner assist you with the positive portion of the rep, then perform the negative on your ownâand do it slowly. Even doing just the negative still makes the muscles work and still breaks down the muscle, both of which force the muscle fibers to rebuild and grow so they can handle that load in the future. Many of us train biceps with an emphasis on chasing the pumpâan obsession that goes back as far as Arnold's famous monologue in ""Pumping Iron."" As great as the pump feels, it's also beneficial. Nutrient-rich blood coursing through the muscles in greater-than-normal amounts is key for growth. Since the pump is what helps your muscles rebuild bigger and stronger, learning how to use it to your advantage can seriously <a href=""https://www.bodybuilding.com/content/the-arm-workout-youll-feel-till-next-week.html"">accelerate biceps growth</a>. Movements such as cable curls and machine curls that keep tension on the biceps are great for increasing the pump. If you want to go even more advanced, you can incorporate <a href=""https://www.bodybuilding.com/fun/add-2-inches-to-your-guns-by-spring-break.html"">occlusion training</a> or use tourniquets. Positioning can mean more than performing your curls standing, seated, or even lying down. When you're training biceps, it can also mean taking elbow and even hand placement into consideration. Where you hold the weight with your hands can affect how the muscles engage and how they work. Placing your hands against the inside of a dumbbell when doing dumbbell curls shifts the focus of the biceps. Neutral hand positioning, used in exercises such as the hammer curl, targets the brachialis and forearms. Going wider with your grip on barbell curls shifts the focus to the inner head of the biceps. Your elbows can play a positive role, as well. Most curls require your elbows to be at your sides. If you perform a drag curl and let your elbows drift toward your back, you can get a deeper stretchâand a better contraction. If your elbows come forward, as with a preacher curl, the short head of the biceps is more active. Adding both types of movements makes for a better overall workout and, in the long run, <a href=""https://www.bodybuilding.com/content/shrink-your-workout-grow-your-chest-and-back.html"">greater growth</a>.",4 Musts To Maximize Biceps Growth
26,"The name says it all: This is one brutal shoulder workout. But what feels like total annihilation for some is just another day at the gym for MuscleTech-sponsored athlete and Team Bodybuilding.com member Abel Albonetti. Known for his high-volume training and willingness to endure pain in pursuit of gains, Albonetti shares his meanest shoulder workout yet. Nearly every exercise of this workout ends in a dropset, and in some cases a double or triple dropset. A dropset is where you perform the <a href=""https://www.bodybuilding.com/content/the-shoulder-workout-that-overcomes-any-training-plateau.html"">prescribed number of reps</a> for the set, then drop to a lower weight and immediately perform another set to failure at that weight. If it's a double or triple drop, you drop down and <a href=""https://www.bodybuilding.com/content/super-pump-arm-workout.html"">go to failure</a> twice on a double and three times on a triple. For example, on the seated cable shoulder press, you'll perform 3 sets of 10, then on the fourth set perform 10 reps, drop the weight, rep to failure, drop the weight, rep to failure, drop the weight one last time, and rep to failure. For the final burnout <a href=""https://www.bodybuilding.com/content/how-to-get-six-pack-abs-using-supersets.html"">superset</a> at the end, you'll repeat the side raise and the front raise, this time using the same set of dumbbells for both. Perform the side raises to failure, then front raises to failure before resting, then repeat for 4 total sets. For an extra burn, hold the weights up as long as you can at the end of each set, increasing the time your shoulders spend under tension.",Abel Albonetti's Brutal Mass-Building Shoulder Workout
