,text,title
11,"If <a href=""https://www.bodybuilding.com/fun/podcast-episode-49-abel-albonetti-on-how-he-earned-and-keeps-those-abs.html"">Abel Albonetti</a> says this is the meanest workout he's ever done, you'd better be prepared for a serious smackdown. A MuscleTech-sponsored athlete and Team Bodybuilding.com member, Albonetti is known for his hardcore workouts, and this arm blast doesn't disappoint. During a workout that had Albonetti himself groaning in pain during filming, you'll be supersetting biceps exercises with triceps exercises in a way that quickly exhausts your arms. That's too bad, because it's going to be a very long workout. All right, campers, cinch up your shorts and let's get to it. Albonetti starts you off with 4 straight sets of dumbbell curls. Take each rep slow and easy with lots of <a href=""https://www.bodybuilding.com/content/youre-not-doing-slow-negatives-on-these-moves-you-should-be.html"">good, long negatives</a>. During the concentric portion of the lift, rotate your pinkies all the way in to get full rotation at the top of the exercise. For the fifth and final set, drop the weight by half. As you do eight reps with one arm, keep the other arm in an isometric hold. Switch arms and repeat. Immediately do 7 more reps with one arm, keeping the other in an isometric hold, then switch arms and do 7 more. Continue decreasing the number of reps by 1 until only 1 remains. Do that rep with each arm to finish. Follow the same rep plan for the skullcrushers. Hold the stretch at the bottom of the rep, keeping tension on your triceps. When you do the preacher curls, make sure you're not going all the way up and losing tension. Keep that bar constantly moving so your muscles are contracted the whole time. When you're doing the triceps extension, tuck in your elbows. Don't flare them out. Go all the way down to stretch out your triceps. As with the preacher curls, don't pause at the top. Keep going to maintain tension on your biceps and triceps the whole time. On the last set, Albonetti tosses in a double <a href=""https://www.bodybuilding.com/content/what-makes-dropsets-so-good-but-so-nasty.html"">dropset</a>âfor both exercises. Go to failure on these. You might not be able to do as many reps as you did at first, but push for at least 6 reps. Go all the way down on the incline curls for a good biceps stretch. At the bottom, flex your triceps to stretch your biceps to the max. After you complete the twelfth rep of the fourth set, lower your arms all the way one more time and hold 30 seconds for a good stretch. Drop the weight by about 10 pounds, rep to failure, and lower the dumbbells for another 30-second stretch. Reduce the weight another 10 pounds, rep to failure, and repeat. On the overhead extensions, let the rope go all the way back to fully stretch your triceps. After the twelfth rep in the fourth set, repeat the dropsets exactly as you did for the incline curls.Â Â Â Â Â Â Â Â Â Â  According to Albonetti, if you can do 10 reps or more before failing in either of these final sets, add more weight the next time. Do the first seven barbell curls while standing up, moving the bar up from your thighs to parallel to your waist, then immediately sit down for the next seven curls. When you're sitting, you won't be able to lower the bar past your thighs. Once you've done seven of these reps, stand up again and do the last seven reps as full reps, moving the bar from your chest to your thighs for a total of 21 reps. Stand for all the triceps push-downs. For the first seven reps, start with the rope at your waist and push down to your thighs. For the next seven, start with the rope at your shoulders and push down to your waist. For the final seven reps, do complete reps, moving the rope from your shoulders to your thighs for another total of 21 reps. On the rope push-downs, flare the rope ends as much as possible. Alternate your arms on the hammer curls to go as heavy as possible. When you're doing the triceps extensions, as the cable goes across your body, squeeze your triceps for a full contraction. At the bottom, squeeze your arm muscles for about half a second. What better way to finish Albonetti's mean-ass workout than to strap on a pair of <a href=""https://www.bodybuilding.com/content/your-complete-guide-to-blood-flow-restriction-training.html"">BFR</a> straps? You'll achieve a huge pump and engorge your arms with nutrients and blood. Position the BFR bands high up on your biceps. Wrap them with a tightness of 6-7 out of 10. Keep them in place for all 5 sets. As you do these BFR sets, rest 45 seconds between sets to create that extreme pump. Albonetti recommends doing this workout once every two weeks. There's too much volumeâand it's just too damn toughâto do it every week.",The Meanest Mean-Ass Arm Workout Yet From Abel Albonetti
12,"Far too often, we succumb to the idea that there's a single way to train for every lifter. Case in point: Want to get strongâlike, seriously strong? Then of course, you're going to live and breathe compound movements, 5 reps per set or less. <a href=""https://www.bodybuilding.com/content/the-worlds-strongest-man-works-at-bodybuildingcom.html"">Jesse Norris</a> chuckles at these preconceptionsâand his training just chucks them. If you follow him on <a href=""https://www.instagram.com/jessenorr/"" target=""_blank"">Instagram</a> (which you really should), you'll see that this record-setting powerlifter is a true devotee of high-rep sets, even as the weights rise to where the rest of the world has to just stand and watch. There's a certain <a href=""https://www.instagram.com/p/BOD3Qk8jag1/?hl=en"" target=""_blank"">set of 10 easy touch-and-go deadlift reps with 495</a>â¦from a 3-inch deficitâ¦using a burly axle bar and no straps or beltâ¦that remains burned into my memory. What's more, if you check out his unique split in the article ""<a href=""https://www.bodybuilding.com/content/lift-as-strong-as-you-look.html"">Lift as Strong as You Look</a>,"" you'll see that Norris also has threeâcount them, threeâdays in his training week labeled ""Accessories (mostly isolation movements)."" That means bodybuilding, baby. Seriously, how many world-class powerlifters would take a perfectly nice Friday afternoon and use it to train isolation-focused legs with a bikini competitor? Probably not many. But when Norris recently visited theÂ Bodybuilding.com gym with fellow Kaged Muscle athlete andÂ up-and-coming NPC bikini competitor <a href=""https://www.instagram.com/ernapalic/"" target=""_blank"">Erna Palic</a>, the burn was on the menu. This week, no matter who you are or what you're training for, put aside your preconceptions and try what Norris deceptively calls a ""quick little leg workout."" It's just 3 supersets, 4 sets apiece, and shouldn't take you more than 30-45 minutes. Then limp home, eat up, and trust that you've given your legs what they needed. Your first set is almost like a warm-up, so go fairly light and nail all the reps on both movements. Once you move to the single-leg reps, it may take a little tinkering to find the right load to use. You should be struggling to hit your last rep or two, but still get it. ""You don't need to go heavy on this exercise,"" Norris advises. ""You're out there in an awkward position, bending straight over."" How light is light? Norris once deadlifted 826 pounds, and is up over 500 for reps regularly. He's using between 185-225 in the video. Just saying. So, don't be a tough guy. ""Keep the bar close to you. Don't let it roll out,"" he further advises. As for depth, while Norris touches the ground with each rep, Palic doesn't. But remember, this is a guy who uses a 3-inch deficit, so the normal rules don't apply to him. Just go low enough to feel a serious stretch on your hamstrings and glutes with a slight knee bend, while keeping a neutral spine. The point is the stretch. ""The idea is that you're hitting hamstrings and glutes, and then quads. Kinda like we did on the first circuit,"" Norris says. As such, he hits his reps on the leg press in a very quad-centric style: feet fairly high on the platform, shoulder-width apart, toes pointed out just slightly, and pushing through the heels. ""This is going to hurt,"" Norris promises. Of course, walking lunges are a quad and glute incinerator on their ownâlet alone after 8 sets of additional work. So yes, it'll suck. Having someone mentally push you through it, like Norris does for Palic, isn't a bad idea. As you fatigue, resist the urge to let that front knee drift too far out; just keep pushing through the heel, lean forward slightly at the torso, and try not to slip on the teardrops. The last exercise is also the simplest. Just sit down and knock out your reps, making sure to use a respectable range of motion and feel the stretch at the bottom of each rep. Now, stagger off the machine, slug a shake, and hit the showers.","The Fast, Simple Leg Routine For Every Kind Of Lifter"
13,"Rarely does watching a 20-minute workout feel so captivating, but listening to IFBB pro Branch Warren discuss his training, his career, and what it takes to be on top is an experience any past, present, or future bodybuilder should have. This back workout is straightforward, but Warren's approach makes it special. Never content to leave anything in the tank, he pushes himself to the limit, and takes us along for the ride. ""I usually start with a lat pull-down,"" explains Warren. ""It works the outside of your lats. I have to do that first to <a href=""https://www.bodybuilding.com/content/how-do-you-know-when-youve-warmed-up-enough.html"">warm up</a> before I start doing T-bar rows or one-armed rows or anything like thatâreal heavy stuff. I want to be warmed up."" Otherwise, Warren says he doesn't have a set program for back. ""I train by how I feel,"" he explains. ""Sets, repsâthey kind of change around on a weekly basis based on how I feel. I always try to <a href=""https://www.bodybuilding.com/content/when-to-use-intensity-boosters-in-your-workouts.html"">take sets to failure</a>, dating back to when I was competing. If I had it in my mind I was going to do 10 reps, then I got to 10 and I could do 2 more, I'd do 2 more. I would train until I couldn't physically move the weight anymore."" Sometimes, Warren goes beyond failure, using dropsets and stripping plates to keep the set going. ""Do as many as you can, pull some weight off, and keep going,"" he says. ""That's a way to completely and thoroughly exhaust the muscle and force as much blood as possible in there. That will translate into to growth."" ""Back was one of my weak points,"" explains Warren. ""When I turned pro back in 2001, I trained for that show [NPC Nationals] for about nine months, and I didn't do legs one time in that whole prep."" As a long-time lifter and pro bodybuilder, Warren doesn't spare his physique a brutally honest critique. ""I was bottom heavy,"" he explains. ""I knew that in order to win, I didn't need to just have the best legs on stage, I needed to have the best physique on stage. I wanted to be pro. So, I stopped training legs, focused on upper body, came in 18 pounds heavier from my previous show, and I won. That 18 pounds? That was all from the waist up."" After turning pro, Warren didn't jump right back into competing. He took time off, because he still felt his physique wasn't where it needed to be. He still had weak points he needed to bring up, namely, shoulders and back. ""Shoulders establish your whole symmetry,"" explains Warren. ""Especially having the kind of quads and calves that I hadâif you're not wide up top, if you don't have broad shoulders, you're not going to look right. And if you don't have good symmetry, then forget about being a pro."" When considering whether being a professional bodybuilder boils down to genetics, good symmetry, or just dumb luck, Warren steps back and looks at the big picture. ""You know, I always focus on all the things I can control,"" he says. ""Training is definitely within your control. I've done these crazy, crazy workouts for years and years, and slowly but surely, my back came up and I started winning the big shows. ""That's why I push myself so hard in the gym. I knew if I could out-work all my contemporaries, eventually I could beat them onstage. There wasn't anyone out there I didn't beat at one time or another. I beat guys I had no business beating. Genetically, they were far superior. I just wanted it more."" But is wanting it more all it takes to push yourself? ""People always ask me, 'How do you train so hard, so consistently like that time and time again,'"" Warren says. ""My answer was always that I want to win. And that was true. But now that I'm not competing, it's hard to push myself to that level. Being onstage, I never wanted to lose a competition. Somehow, that worked for me."" Never wanting to lose, always wanting to winâthese are familiar desires for every bodybuilder. ""Off-season, I remember trying to eat everything I could because I was trying to grow,"" says Warren. ""I'd be up until 1 a.m. trying to finish my food. Just cussing my food, chewing it up, drinking a glass of water, just trying to swallow it and take another bite. I did that for years. ""Then, pre-contest, you're eating seven times a day but you'll feel like you're starving. You know, I'd get up at 3 or 4 in the morning to do my cardio just so I could eat breakfast."" Warren's motto for bodybuilding glory is simple: Train smart. There ain't no shortcuts. ""If you don't have it, there's no drug, no magic pill, no secret program that's going to give it to you,"" he explains. ""Just hard, hard work. And you've got to eat right. Eating is probably 70 percent of the equation. The other 30 percent happens in the gym. ""Nutrition involves proper supplementation and proper food. That's the hard part, because you have to do it day in and day out. And if you're trying to be a top bodybuilder, it's going to take many years. You're looking at a decade-long investment of your life and time and hard work, and maybeâif you have what it takesâyou'll get there. For those chosen few that have it."" No longer competing, Warren has modified his relentless approach. ""These days, I still train,"" he explains. ""I always will train, as long as I'm physically capable of training, because I love it. ""I still train hard, but I'll be the first to tell you I don't train at that next level that I did for so long. There's no point in doing so. Number one, I don't want to get injured. And number two, I'm not stepping onstage anymore, and without that motivation, it's hard to find that extra gear."" Simply put, Warren's goals have shifted: ""Now, I want to be in shape for life,"" he says. ""I love to hunt, I love the mountainsâand when you're trying to crawl through the mountains at 275 poundsâmore than 300 with your gearâit kicks your ass. ""I've lost some weight, but I'm still training, still in shape. I'm incorporating some different types of training and some fun stuff, so I feel great physically. I feel better than I've felt in a long time."" What's changed the most in his approach is his nutrition. ""I think the main thing is I don't eat as much,"" says Warren. ""I was <a href=""https://www.bodybuilding.com/content/how-to-gain-weight.html"">eating six meals a day</a>, sometimes seven, depending on my training program. Now I eat four meals a day, so not quite as many calories. Eating seven meals a day, if you've never done it, is a job in itself. ""I weigh about what I used to weigh onstage. And I don't look like that [chuckles]. That being said, I still want to train, I still want to be big, I still take pride in my training, and I enjoy it. Especially now with a family, businessesâthat hour, hour and a half, each day is my time. It's usually about the only time of day that belongs to me. I cherish that. It's one thing in life I love to do and always will."" If his approach to food has changed, have Warren's workouts also changed? ""I've actually branched out and started to do some other types of training back home,"" he says. ""We do what we call a 'run and gun.' We flip tires, we carry sandbags, we boxâall kinds of stuff. ""I don't want to say it's a CrossFit type of workout, but it's a physical fitness type of workout. There's running incorporated into it."" Thinking about his busy life and career, Warren offers this advice to his younger peers: ""I've seen so many of these guys and girls say, 'I can't work, I'm getting ready for a competition,' I've worked my entire life. Even when I was [the] number-two [-ranked bodybuilder] in the world, I still worked. I had a business, I workedâno matter how well I didâbecause I knew one day, this would be over. ""I was very blessed to have a very long career, but all it takes is one injury to end your career."" Though his pro bodybuilding career is behind him, Warren still has sage advice for the iron athlete of today. ""There are a lot of opportunities out there, through social media, for fitness athletes,"" he acknowledges. ""But even if you're a world-class athlete, you only have a finite amount of time to be on top. ""Be smart, train smart, don't injure yourself. There's no magic formula, no magic pills. Just hard work and dedication. ""If you get there, it's worth it. I had a 16-year pro career, and I had a blast. I had the time of my life. It was my dream, and I got to live my dream. So, it can be done. But it just takes time and you've got to be realistic. ""Do this because you love doing it. I never trained for fame or for money. I trained because I loved doing it.""",No-Holds-Barred Back Workout With Branch Warren
14,"It's the middle of the contest season and Maxx Charles has already competed several times, rebounding from 13th place at the Arnold Classic in March to 7th place at the Toronto Pro and 3rd place at Missouri's Muscle Mayhem contest, both of which took place in June. Today he's at Bev Francis Powerhouse Gym on Long Island, New York, getting started on leg day. He's just finished his first set when fellow IFBB pro and multiple 202-and-under Olympia champion Kevin English wanders over. English takes one look at Charles' intensity and grueling training style, laughs, and says, ""There is no mercy in what you do, Maxx. None!"" Charles, who turned pro via his overall win at the 2014 NPC USA Championships does train pretty damn hard, but he trains smart, tooâvery smart. He says his training is instinctual, guided by what he feels and what his body tells him it's safe to do. At the same time, he says he carefully plans every detail of his workout, with not one single rep left to chance. If his approach sounds like a raging contradiction, so what? Look at this man's physique! Ever since he first took up bodybuilding, Charles has been knocked for having an upper body out of sync with his lower body. It's a criticism he shares with fellow IFBB pros Juan Morel, Johnnie Jackson, and even the mighty eight-time Mr. Olympia Lee Haney. Don't be misled: It's not that Charles' legs have ever been weak, it's that his upper body is strong AF. He is incredibly, outrageously wide and carries a tremendous amount of mass through his shoulder girdle and on his arms. In the last few years, he's worked crazy hard to improve his leg development, but he knows he has more to go. Charles is known for thinking outside the box when it comes to his training: No simple 3-sets-of-10 man is he. The <a href=""https://www.bodybuilding.com/content/bodybuildingcoms-10-highest-rated-hamstring-exercises.html"">hamstring training</a> you're about to see is just another example of his unconventionalâand unrelentingâtake on muscle building. <strong>8 sets of 20 reps; increase weight for 4th set, follow with 4 dropsets</strong> Charles steps up to one of Bev's seated leg curl machines and squeezes his considerable mass into position. His first 3 sets are somewhat conventional. With each new set, he adds another 45-pound plate, pausing at the top of each rep and squeezing the hamstring muscles before extending his legs and getting a stretch in the hams. He does 20 reps like this per set. So far so good. It's when he attacks his fourth set that you get a glimpse of what separates Charles from most bodybuilders. He starts with four plates. His girlfriend lightly grips his ankles and follows his legs as he curls the weight downward. At the bottom of the movement, she helps him hold steady for a count of two. Then it's back up to the starting position; another, briefer pause; followed by another repetition. He repeats this 12 more times. When he can't move the weight any longer, he pauses for several secondsâthen somehow rips through 6 more reps on the way to his final destination of 20 reps. As soon as Charles completes his final rep with four plates, his workout partner gets ready to go into <a href=""https://www.bodybuilding.com/content/what-makes-dropsets-so-good-but-so-nasty.html"">dropset</a> mode. He strips a plate from the machine and Charles does 20 more reps. When that's done, he does 20 more with two plates, then 20 with one plate. Throughout this entire 160-rep odyssey, Charles doesn't rush it. He takes time with every rep to squeeze and hold contractions. The last set takes nearly 5 minutes to complete. It's insanely hard. <strong>3 sets of 30 reps; go to partial reps if necessary to complete all 30 reps per set</strong> The average trainer would have called it quits whenâifâhe or she made it through that fourth grueling set of seated leg curls. Charles is anything but average. He's a true bodybuilding freak in a sport where that sobriquet is often bestowed but rarely earned. Instead of resting after his 160 seated curls, he moves on to a Cybex lying leg curl machine, where he will perform 3 sets of 30 reps. He starts out with a full range of motion, squeezing the pad at the top of the movement. As his hams start to burn, he doesn't stop. Instead, he starts cranking out <a href=""https://www.bodybuilding.com/content/ask-the-super-strong-guy-are-partials-the-key-for-strength-gains.html"">partials</a>âstarting out with 3/4 reps and, by the end, flinching his way through 1/2 reps. Even as fatigue grinds him down, Charles keeps the weight moving and his torched hamstrings working. <strong>9 sets of 20-30 reps; increase weight with each set through the 4th set, then decrease weight for the 5th set. Finish with 4 dropsets of 20-30 reps.</strong> Here's a perfect example of how Charles takes a traditional movement and makes it his own. Have you ever put your feet close together higher up on the leg sled when you're doing leg presses? You really feel it in your hamstrings, right? For Charles, this high foot placement isn't an experiment, it's the way he rolls. He puts his feet so high up his toes and the balls of his feet are actually off the sled. Putting just about every plate in the gym on the machine, he moves slowly to avoid over-stressing his hamstrings, taking the weight through a very limited range of motion. He does 3 sets of 30 reps, adding yet more weight with each set. By the fourth set, Charles has somehow stacked 34 platesâ1,530 poundsâon the leg press machine. There is literally no room to add any more weight. His girlfriend and a buddy hover over the machine throughout the set to make sure no plates fall off. Charles pumps out 20-30 reps with 34 plates, then pauses just long enough for his girlfriend and his buddy to strip three plates from each side of the machine. He churns out a fifth set with 28 plates, a sixth set with 22 plates, a seventh set with 16 plates, and eighth set with 10 plates and, finally, a ninth and final set with four plates. It is an agonizing 4-5 minutes to watch as Charles gets his reps with legs that must feel like they've had napalm slathered all over them.",Expect No Mercy: Maxx Charles Takes You To Hamstring Hell
